url1_lang,url2_lang,pair_id,Geography,Entities,Time,Narrative,Overall,Style,Tone,text1,text2,text_summary1,text_summary2,text1_truncate,text2_truncate
en,en,1517420924_1484120724,3,4,1.333333333,3.666666667,4,3.333333333,2.666666667,"The UN Is Hiring English-Speaking DISARMAMENT OFFICERS in New YorkThe UN Is Hiring English-Speaking DISARMAMENT OFFICERS in New York

Pin 3 7K Shares

If you're new here, you may want to subscribe to my RSS feed. Thanks for visiting!

(Psst: The FTC wants me to remind you that this website contains affiliate links. That means if you make a purchase from a link you click on, I might receive a small commission. This does not increase the price you'll pay for that item nor does it decrease the awesomeness of the item. ~ Daisy)

by Daisy Luther

As the Second Amendment conflict heats up across the United States, here’s another “crazy conspiracy theory” that has turned out to be true.

The United Nations is hiring in New York. What positions are they trying to fill?

English-speaking DISARMAMENT, DEMOBILIZATION, AND REINTEGRATION OFFICERS.

This job was posted the day after Christmas. So for all the folks who have been saying “nobody is trying to take your guns” you might want to read this job listing and reconsider your opinion.

Is this in response to the Virginia crisis?

You may recall that citizens of Virginia have become outraged recently by new laws that are likely to pass this month, effectively banning all semi-automatic weapons. Sanctuary counties, cities, and municipalities now cover all but the most urban parts of the state. These sanctuaries have vowed to support the Second Amendment and are refusing to enforce unconstitutional gun laws.

In response, a member of the state congress suggested that Governor Northam could call up the National Guard to disarm residents of Virginia despite the wishes of local governments. In response to that, at least one county has formed a militia and others are expected to spring up. The state’s Attorney General says that these sanctuaries carry no legal weight.

Despite the AG’s opinion and threats from the state government, Virginians appear to have no plans to give up their guns or register them. Many members of law enforcement entities and the National Guard have said that they will not act on unconstitutional orders.

One has to wonder if this is why the UN is hiring “disarmament officers?”

What is the job description?

Here are the responsibilities for the new hires, as per the United Nations job listing.

Within delegated authority, the Disarmament, Demobilization and Reintegration Officer will be responsible for the following duties:

• Acts as a Focal Point for Disarmament, Demobilization and Reintegration (DDR) components for two to three missions, responsible for planning, support to implementation and evaluation;

• Participates in DPO and Integrated Task Force planning meetings for the establishment of a new peacekeeping mission with a potential DDR component;

• Provides technical assistance to peace negotiations;

• Participates in technical assessment missions;

• Advises, develops and reviews (as appropriate) initial DDR functional strategy and concept of operations for further development into a full programme by the DDR component and the National DDR Commission;

• Drafts and reviews DDR inputs to SG report, code cables, and talking points;

• Develops initial result-based framework and budget for new DDR components in new mission;

• Liaises with UNDP and donor community to raise voluntary contributions for DDR programmes;

• Presents and/or defends new and subsequent DDR budgetary requirements in the ACABQ and the 5th Committee of the General Assembly;

• Develops staffing structure and terms of reference for a DDR component, including terms of integration with other UN agencies, funds and programmes;

• Provides technical clearance for applicants to DDR units in new and ongoing missions;

• Provides Headquarters support in planning the civilian and military logistics support for DDR;

• Continually reviews DDR programme strategy and implementation through relevant documents, reports and code cables;

• Conducts field missions to assess implementation of established DDR programmes;

• Identifies potential problems and issues to be addressed and suggests remedies to DDR units in the field;

• Liaises with Member States, UN actors and other DDR interested partners to represent the mission’s DDR component at the Headquarters level;

• Establishes and maintains an outreach network with CSOs and IGOs active in the area of DDR.

• Supports the doctrine development work in the area of DDR in the department, with the Inter-Agency Working Group (IAWG) on DDR and other relevant national and international actors working on DDR issues;

• Contributes to Department-level or Policy Committee-level policy development work on DDR and related issues;

• Maintains and further develops the Integrated DDR Standards – a set of inter-agency policies, guidelines and procedures on DDR;

• On behalf of the Chief of the DDR Section, co-chairs the IAWG on DDR, contributes to bringing coherence to the interaction of the UN system and its partners on DDR;

• Supervises the Associate Expert (Junior Professional Officer) in the development and maintenance of the web-based United Nations DDR Resource Centre;

• Liaises with others (UN, regional organisations and Member States) providing DDR.

Other duties as required. (source)

Also notable is the required language fluency – English – and the desired experience.

Seven years of relevant experience in disarmament affairs, political analysis or in national military or paramilitary service, preferably related to the design, implementation or review of DDR. (source)

Employees would answer to the Secretary-General of the United Nations.

As per the UN, here are some specifics about this job description. Of special note:

Disarmament is the collection, documentation, control and disposal of small arms, ammunition, explosives and light and heavy weapons of combatants and often also of the civilian population. Disarmament also includes the development of responsible arms management programmes. (source)

As well, the UN especially wants women to apply for this job, citing gender equality. But is it possible they think that a gun owner might have more ethical difficulty firing on a woman trying to take their weapons than a man?

The US is no longer part of the UN Arms Trade Treaty.

You may recall back in 2013, the United Nations convinced then-Secretary of State John Kerry to sign a treaty that “unequivocally bans arms transfers that are in violation of a U.N. arms embargo or that exporters have reason to know will be used to commit genocide and other grievous war crimes.”

In 2013, the US signed the UN Arms Trade Treaty but that signature was never ratified. Last April, President Trump officially withdrew from the international gun control treaty.

However noble that may sound, anti-gun control activists were concerned this would lead to the UN being able to disarm Americans on US soil.

So why is the UN looking for English-speaking disarmament experts?

Don’t be silly, “no one is coming to take your guns.”

How many times has someone told you not to worry – that nobody is coming to take your guns away? That all they want is “common-sense gun laws?”

In light of the current political climate and this job listing, I’d say that is an outright a lie.

What do you think about this job listing? Alarming or not? Please share your thoughts in the comments.

About Daisy

Daisy Luther is a coffee-swigging, globe-trotting blogger who writes about current events, preparedness, frugality, voluntaryism, and the pursuit of liberty on her website, The Organic Prepper. She is widely republished across alternative media and she curates all the most important news links on her aggregate site, PreppersDailyNews.com. Daisy is the best-selling author of 4 books and runs a small digital publishing company. You can find her on Facebook, Pinterest, and Twitter.","Greta Thunberg says talking to Trump would be a waste of time

Activist Greta Thunberg attends a climate strike outside the Swedish parliament in Stockholm on December 20. During an interview Monday, Greta said she doubts she would have talked to President Trump at last fall’s climate summit in New York because “he’s not listening to the scientists and experts, so why would he listen to me?” (Pontus Lundahl/TT via AP)

Teenage climate change activist Greta Thunberg said Monday that talking to President Trump at a United Nations summit on global warming would have been a waste of time, because he would not have paid attention.

In an interview with BBC radio’s “Today” program, for which she was the guest editor Monday, Greta also said that she regarded personal attacks on her as funny and that she hoped to go back to having a normal life.

A video of the 16-year-old Swedish campaigner giving Trump what media described as a “death stare” at a U.N. climate summit in New York in September went viral on social media. Trump has questioned climate science and is pulling the United States out of the 2015 Paris agreement on climate change.

Asked what she would have said to the president if they had spoken, Greta said: “Honestly, I don’t think I would have said anything because obviously he’s not listening to scientists and experts, so why would he listen to me?

“So I probably wouldn’t have said anything. I wouldn’t have wasted my time,” she said.



Greta watches as Trump enters the United Nations to speak with reporters at the summit September 23. (Andrew Hofstetter/Reuters)

This month Brazilian President Jair Bolsonaro called Greta “a brat.” Trump has said on Twitter she needs to work on her anger management problem.

“Those attacks are just funny because they obviously don’t mean anything,” she said. “I guess of course it means something — they are terrified of young people bringing change which they don’t want — but that is just proof that we are actually doing something and that they see us as some kind of threat.”

Greta came to world attention when she began a grass-roots campaign at age 15 by skipping school every Friday to demonstrate outside the Swedish parliament. The protests have inspired millions of young people to take action against climate change.

Thunberg, who was named Time Magazine’s Person of the Year for 2019, said becoming an activist had helped rescue her from the depression she had previously been suffering.

The teenager rejoined activists outside the Swedish parliament this month after four months of overseas trips to attend climate conferences in New York and Madrid.

“I hope I won’t have to sit outside the Swedish parliament for long. I hope I don’t have to be a climate activist anymore,” she said, adding she was looking forward to returning to school in August.

“I just want to be just as everyone else. I want to educate myself and be just like a normal teenager.”

— Associated Press

Read more from KidsPost:

No bold plans come from United Nations climate summit

Greta Thunberg’s trip to New York inspires young climate activists

Students worldwide walk out of school to push for action on climate change","So for all the folks who have been saying “nobody is trying to take your guns” you might want to read this job listing and reconsider your opinion.Other duties as required.Last April, President Trump officially withdrew from the international gun control treaty.Don’t be silly, “no one is coming to take your guns.”

How many times has someone told you not to worry – that nobody is coming to take your guns away?Alarming or not?","Trump has questioned climate science and is pulling the United States out of the 2015 Paris agreement on climate change.Thunberg, who was named Time Magazine’s Person of the Year for 2019, said becoming an activist had helped rescue her from the depression she had previously been suffering.I hope I don’t have to be a climate activist anymore,” she said, adding she was looking forward to returning to school in August.“I just want to be just as everyone else.I want to educate myself and be just like a normal teenager.”

— Associated Press

Read more from KidsPost:

No bold plans come from United Nations climate summit

Greta Thunberg’s trip to New York inspires young climate activists

Students worldwide walk out of school to push for action on climate change","Jerzy Bukowski: Wszechobecny Tusk

Opublikowano dnia 01.01.2020 15:00

Przyszłość nie wybierającego się bynajmniej na polityczną emeryturę Donalda Tuska z pewnością zaciąży nad kształtem całej opozycji.



fot. screen YouTube

Nie wystartuje w wyborach prezydenckich, nie zamierza ubiegać się o pozycję lidera opozycji, nie zgłasza aspiracji do powrotu na funkcję przewodniczącego Platformy Obywatelskiej.



Wydawać by się mogło, że Donald Tusk zniknął z polskiej sceny politycznej, chociaż właśnie powrócił do kraju. A jednak wszystkie kalkulacje co do jej przyszłego kształtu obracają się właśnie wokół byłego premiera.



Mało kto wierzy, aby nie chciał on jeszcze odegrać na niej istotnej roli. Jedni twierdzą, że myśli głównie o starcie w wyborach prezydenckich w 2025 roku, drudzy sądzą, iż jego marzeniem jest utworzenie dużej partii, przy czym zdania na temat tego, czy będzie chciał połączyć PO z Koalicją Polską, czy też z ugrupowaniami lewicowymi bądź z formacją, jaka może powstać wokół ubiegającego się o prezydenturę Szymona Hołowni są na razie podzielone.



Jedno wydaje się pewne: żeby mógł zrealizować swoje plany, na czele Platformy musi stanąć sprzyjający mu polityk, na pewno więc nie Grzegorz Schetyna. I to jest zadanie dla Tuska na najbliższe dni. A że należy do mistrzów zakulisowych rozgrywek, obecny lider PO i Koalicji Obywatelskiej ma się czego obawiać, chociaż i on potrafi nieźle sobie radzić w tej materii.



Przyszłość nie wybierającego się bynajmniej na polityczną emeryturę Donalda Tuska z pewnością zaciąży nad kształtem całej opozycji.



","Goście programu ""Minęła 20"" zostali zapytani o wpis Leszka Jażdżewskiego, który napisał na Twitterze, że lider opozycji ""powinien być jak żona cezara"". ""Media donoszą o kolejnych przypadkach korupcji w szpitalu prof. Grodzkiego, które niestety wyglądają wiarygodnie. Grodzki powinien pozwać te osoby. A opozycja pomyśleć o wymianie marszałka senatu"" – stwierdził. Odpowiedział mu poseł PO Michał Szczerba, który bronił prof. Grodzkiego.

Zdaniem Antoniego Trzmiela, chodzi po prostu o ""walkę o władzę wokół Donalda Tuska"". – Historia jest prosta. Marszałek Tomasz Grodzki jest podgryzany przez tych, którzy wokół Donalda Tuska chcieliby stworzyć bardziej postępową siłę. Postacią wybraną przez Tuska był Leszek Jażdżewski. Wymienił bardzo progresywną agendę w jego imieniu. To walka o władzę wokół Donalda Tuska – ocenił.

Red. naczelny DoRzeczy.pl zwrócił też uwagę, że PO broni sprawy, której nie da się bronić. – Po stronie PO nie ma żadnej refleksji, że bronią sprawy, której bronić się nie da. Każdy wie, jak w latach 90. ten mechanizm wyglądał, choć nie każdy lekarz z niego korzystał – tłumaczył.



"
