url1_lang,url2_lang,pair_id,Geography,Entities,Time,Narrative,Overall,Style,Tone,text1,text2,text_summary1,text_summary2,text1_truncate,text2_truncate
en,en,1484188243_1483769841,1,2,1,2.666666667,2.333333333,1.666666667,1.333333333,"Our view: Curtis Jones to be Liverpool breakthrough star for 2020The Reds head into 2020 top of the league and top of the world. With Jürgen Klopp’s men threatening to dominate the coming decade there has never been a better time to be a Kopite. Melwood has been preparing for this coming period of dominance, we believe Curtis Jones will be the breakthrough star of 2020.

Jones has been at Anfield since he was a kid, first turning out for the club at under-nine level. He has rocketed through the ranks at Melwood, impressing at every level, often captaining his side.

The local lad made his first debut in January 2019, starting against Wolves in the FA Cup, he has since collected the man of the match award for his efforts against MK Dons in the League Cup, he scored the winning penalty against Arsenal in the next round.

Jones’ Premier League debut came during the Reds’ 3-0 win over Bournemouth at the start of December. We can expect more first team minutes for him in the near future.

Curtis Jones will surely be our breakthrough star of 2020 as it is the perfect time for him. The Reds have their strongest squad in modern history, there will be plenty of games where we are leading handsomely enough to bring on one of the youngsters.

As long as Jones continues to impress during the cameos we can expect him to win a few starts. The intense footballing style of Klopp’s Liverpool demands rotation, we need to keep our players refreshed in order to maintain our high press – Jones could benefit from this rotation.

Of course, Jones may also benefit from our vast lead at the top of the table, if the Reds were to win the league with time to spare, we may see the gaffer blood some young talent.","EPL: Wenger speaks on Liverpool going unbeaten, winning title this seasonFormer Arsenal manager, Arsene Wenger, has disclosed that Liverpool are on course to go unbeaten and win the Premier League title this season.

Liverpool wrapped up their 17th win of the campaign with a 4-0 win over second-placed Leicester City on Boxing Day.

The Reds have only dropped points against Manchester United so far this season.

But Wenger now believes that Jurgen Klopp’s men are on the right track to repeat Arsenal’s ‘Invincibles’ feat of 2003/2004 this term.

Asked whether Liverpool can pull off an ‘Invincibles’ season, Wenger told beIN SPORTS: “They were close last year and they are still on course to do it.

“But I think what Liverpool is expecting at the moment is just to win the Premier League and that is the first target for such a football city.

“To stay for 30 years without winning the Premier League… nobody would have predicted that.

“That is their main target and I think they are on a good run and on a good course to achieving that this season because their main opponent is quite far away already.”

Liverpool will face Sheffield United on Thursday night in their next Premier League fixture at Anfield.","With Jürgen Klopp’s men threatening to dominate the coming decade there has never been a better time to be a Kopite.He has rocketed through the ranks at Melwood, impressing at every level, often captaining his side.Jones’ Premier League debut came during the Reds’ 3-0 win over Bournemouth at the start of December.Curtis Jones will surely be our breakthrough star of 2020 as it is the perfect time for him.The intense footballing style of Klopp’s Liverpool demands rotation, we need to keep our players refreshed in order to maintain our high press – Jones could benefit from this rotation.","EPL: Wenger speaks on Liverpool going unbeaten, winning title this seasonFormer Arsenal manager, Arsene Wenger, has disclosed that Liverpool are on course to go unbeaten and win the Premier League title this season.Liverpool wrapped up their 17th win of the campaign with a 4-0 win over second-placed Leicester City on Boxing Day.The Reds have only dropped points against Manchester United so far this season.Asked whether Liverpool can pull off an ‘Invincibles’ season, Wenger told beIN SPORTS: “They were close last year and they are still on course to do it.“That is their main target and I think they are on a good run and on a good course to achieving that this season because their main opponent is quite far away already.”

Liverpool will face Sheffield United on Thursday night in their next Premier League fixture at Anfield.","<s> Baku, 31. Mai, AZERTAC Bei einem Telefonat haben der aserbaidschanische Außenminister Elmar Mammadyarov und sein afghanischer Amtskollege Mohammad Hanif Atmar die Bedeutung der Ausweitung der Beziehungen zwischen den beiden Ländern sowohl im bilateralen, als auch im trilateralen und multilateralen Format betont. Der afghanische Minister äußerte sich zufrieden über die Unterstützung Aserbaidschans für internationale Bemühungen zur Gewähen auszuweiten. Die Minister verwiesen auf die Wichtigkeit der weiteren Stärkung des Rechtsrahmens zwischen den beiden Ländern.</s","Baku, 21. Mai, AZERTAC

Aserbaidschan ist das bevölkerungsreichste Land Südkaukasiens. Nach dem Stand vom 1. April des laufenden Jahres ist die Zahl der Einwohner Aserbaidschans in den ersten drei Monaten um 12. 848 Menschen oder 0,1 Prozent gestiegen und hat damit 10 Millionen 79 Tausend 956 Menschen erreicht.

Laut der Auskunft des Statistischen Komitees gegenüber AZERTAC leben 52,8 Prozent der Bevölkerung in den Städten und 47,2 Prozent auf den Dörfern. Die Männer bilden 49,9 Prozent und die Frauen machen 50,1 Prozent der Gesamtzahl der Einwohner aus, hieß es in der Meldung."
