url1_lang,url2_lang,pair_id,Geography,Entities,Time,Narrative,Overall,Style,Tone,text1,text2,text_summary1,text_summary2,text1_truncate,text2_truncate
en,en,1484084337_1484110209,4,4,1,4,4,1.666666667,2,"Virginia man arrested in fatal DUI crash in West VirginiaMARTINSBURG, W.Va. — A suspected drunken driver was arrested in a New Year’s Day highway crash that killed another motorist in West Virginia, police said.

The accident occurred early Wednesday along southbound Interstate 81 in Berkeley County, The Journal reported.

Cody Wade Braithwaite, 32, of Winchester, Virginia, was charged with DUI with death, fleeing DUI, and being a prohibited person in possession of a firearm and a fugitive from justice, Berkeley County Sheriff Curtis Keller said.

Keller said a deputy investigating calls about a reckless driver attempted to make a traffic stop, but the suspect’s vehicle sped up and hit a car, which then struck a guardrail. The driver of the car was pronounced dead at the scene. The driver’s name was not immediately released.

The suspect’s vehicle also hit a deputy’s cruiser before being stopped, Keller said.

Braithwaite was being held without bond in the Eastern Regional Jail. It wasn’t immediately known whether Braithwaite has an attorney.

___

Information from: The Journal, http://journal-news.net/

Copyright 2020 The Associated Press. All rights reserved. This material may not be published, broadcast, rewritten or redistributed.","Haiti’s leader marks independence day amid security concernsPORT-AU-PRINCE, Haiti — Haitian President Jovenel Moïse broke with tradition on Wednesday and celebrated the country’s independence day in the capital for security reasons following months of political turmoil.

Moïse, whose government has been accused of corruption, denounced graft during his speech at the National Palace in Port-au-Prince and urged Haiti’s elite to work with the government and help create employment.

“We’re still extremely poor,” he said. “Those who continue to get rich find it normal that they do not pay taxes, find it normal that there can be no competition, find it normal that they set prices for consumers, especially when this consumer is the state itself.”

Moïse also apologized for the country’s ongoing power outages and renewed his 2016 campaign pledge to provide electricity 24 hours a day, saying it was harder to accomplish than he imagined.

The speech that marked the 216th anniversary of the world’s first black republic was originally slated to take place in the northern coastal town of Gonaives, where Jean-Jacques Dessalines declared Haiti’s independence. But the town, like many others, was hit by violent protests that began in September amid anger over corruption, fuel shortages and dwindling food supplies as opposition leaders and supporters demanded the resignation of Moïse. More than 40 people have been killed and dozens injured.

Large-scale protests in Port-au-Prince have since dissipated, although smaller ones are still occurring elsewhere in the country. On Wednesday, opposition leaders and supporters gathered in Gonaives to attend the funeral of an anti-government protester and then carried his coffin through the streets as more protesters joined them.

Copyright 2020 The Associated Press. All rights reserved. This material may not be published, broadcast, rewritten or redistributed.","Cody Wade Braithwaite, 32, of Winchester, Virginia, was charged with DUI with death, fleeing DUI, and being a prohibited person in possession of a firearm and a fugitive from justice, Berkeley County Sheriff Curtis Keller said.Keller said a deputy investigating calls about a reckless driver attempted to make a traffic stop, but the suspect’s vehicle sped up and hit a car, which then struck a guardrail.The suspect’s vehicle also hit a deputy’s cruiser before being stopped, Keller said.___

Information from: The Journal, http://journal-news.net/

Copyright 2020 The Associated Press.All rights reserved.","But the town, like many others, was hit by violent protests that began in September amid anger over corruption, fuel shortages and dwindling food supplies as opposition leaders and supporters demanded the resignation of Moïse.Large-scale protests in Port-au-Prince have since dissipated, although smaller ones are still occurring elsewhere in the country.On Wednesday, opposition leaders and supporters gathered in Gonaives to attend the funeral of an anti-government protester and then carried his coffin through the streets as more protesters joined them.Copyright 2020 The Associated Press.This material may not be published, broadcast, rewritten or redistributed.","<s> Rather than winding down for the festive period, the staff and judges at Truro Crown Court have had an extremely busy December dealing with a huge number of serious cases. Many criminals have been given huge sentences ensuring that this Christmas isn't the only one they'll spend behind bars. Cornwall is certainly a better place without some of these criminals walking our streets over the festive period. Here are the criminals sentenced at Tr months to be served on consecutively to the sentence he is already serving ensuring he will remain behind bars even longer.</s","<s> See our privacy notice Could not subscribe, try again later Invalid Email At Christmas we're all guilty of over-indulging on the delicious food and drink on offer. It's more than likely we'll have put on a few pounds over the festive season and could be regretting that last sausage roll at the buffet. With a New Year starting many of us will be making a resolution to shape up and lose some excess weight, so fo veg and mountains of fruit. Like us on Facebook Follow us on Twitter theliverpoolecho Follow @LivEchonews</s"
en,en,1484396422_1483924666,4,4,1,4,3.666666667,1.666666667,1.333333333,"Guyana: Three injured after car crashes into utility poleShare This On:

Pin 11 Shares

(NEWS ROOM GUYANA) — Three persons are currently hospitalized in a serious condition following an accident on the Crabwood Creek Public Road on New Year’s morning.

According to information received, motorcar PNN 7976 driven by 22-year-old Seeram Ramdat was speeding when it collided with a utility pole, injuring the driver and two passengers.

The News Room understands that while driving over the Blackwater Creek Bridge, Ramdat lost control of the vehicle which turned turtle and careened about 200 feet away before crashing into the utility pole and coming to a halt on a resident’s bridge.

The two occupants, 32-year-old Keron Phillips and 45-year-old Ramnand Kishwar were removed from the wreck in semi-conscious states and rushed to the Skeldon hospital.

The driver fled the scene and was subsequently apprehended at his Lot 80 Grant 1718 Crabwood Creek home in a traumatic state. He was also taken to the Skeldon Hospital where he is admitted in a stable condition.

The News Room understands that the vehicle is owned by an elderly woman, and Ramdatt took it without her knowledge.

Police Commissioner Leslie James on Wednesday disclosed that there has been an 8% increase in road fatalities in 2018.

( 0 ) ( 0 )","Fire kills more than 30 animals at zoo in western GermanyBERLIN - A fire at a zoo in western Germany in the first minutes of 2020 killed more than 30 animals, including apes, monkeys, bats and birds, authorities said. Police said the fire may have been caused by sky lanterns launched to celebrate the new year.

Several witnesses reported that they had seen the cylindrical paper lanterns with little fires inside flying in the night sky shortly after midnight Wednesday near the Krefeld zoo, Gerd Hoppmann, the city’s head of criminal police told reporters.

“People reported seeing those sky lanterns flying at low altitude near the zoo and then it started burning,” Hoppmann said.

Police and firefighters received the first emergency calls at 12:38 a.m.

The zoo near the Dutch border said that the entire ape house burned down and more than 30 animals, including five orangutans, two gorillas, a chimpanzee and several monkeys, as well as fruit bats and birds, were killed.

Only two chimpanzees could be rescued from the flames by firefighters. They suffered burns but are in stable condition, zoo director Wolfgang Dressen said.

“It’s close to a miracle that Bally, a 40-year-old female chimpanzee, and Limbo, a younger male, survived this inferno,” Dressen said, adding that many animal handlers were in shock at the devastation.

“We have to seriously work through the mourning process,” Dressen said. “This is an unfathomable tragedy.”

YOU MIGHT BE INTERESTED IN...

The zoo director also said than many of the dead animals were close to extinction in the wild.

The zoo said that in addition to the two rescued chimpanzees, the Gorilla Garden near to the Ape House didn’t go up in flames and that gorilla Kidogo and six other members of his family group are alive.

Criminal police officer Hoppmann said that the use of sky lanterns is illegal in Krefeld and most other parts of Germany and asked that the people who launched them or people who witnessed anything should come forward to police.

Germans usually welcome in the new year with fireworks at midnight and private persons are allowed to buy and launch fireworks. Sky lanterns, however, are both illegal and uncommon in Germany.

Sky lanterns, which are sometimes also called Chinese lanterns, are a sort of hot-air balloon made of paper. They have been used in Asia for celebratory events for centuries.

YOU MIGHT BE INTERESTED IN...

Hoppmann said investigators found some used lanterns on the ground that hadn’t burned entirely. They were 34 centimetres (13.4 inches) long, made out of white paper with an opening at the bottom where a small fire would have been suspended. The fire heats the air inside, making them fly and shine at night.

Get more of the Star in your inbox Never miss the latest news from the Star. Sign up for our newsletters to get today's top stories, your favourite columnists and lots more in your inbox Sign Up Now

Hoppmann said some of the lanterns had handwritten notes on them.

The Krefeld zoo was opened in 1975 and attracts some 400,000 visitors each year. It will remain closed on Wednesday.","Guyana: Three injured after car crashes into utility poleShare This On:

Pin 11 Shares

(NEWS ROOM GUYANA) — Three persons are currently hospitalized in a serious condition following an accident on the Crabwood Creek Public Road on New Year’s morning.The News Room understands that while driving over the Blackwater Creek Bridge, Ramdat lost control of the vehicle which turned turtle and careened about 200 feet away before crashing into the utility pole and coming to a halt on a resident’s bridge.The two occupants, 32-year-old Keron Phillips and 45-year-old Ramnand Kishwar were removed from the wreck in semi-conscious states and rushed to the Skeldon hospital.The News Room understands that the vehicle is owned by an elderly woman, and Ramdatt took it without her knowledge.Police Commissioner Leslie James on Wednesday disclosed that there has been an 8% increase in road fatalities in 2018.","Several witnesses reported that they had seen the cylindrical paper lanterns with little fires inside flying in the night sky shortly after midnight Wednesday near the Krefeld zoo, Gerd Hoppmann, the city’s head of criminal police told reporters.The zoo near the Dutch border said that the entire ape house burned down and more than 30 animals, including five orangutans, two gorillas, a chimpanzee and several monkeys, as well as fruit bats and birds, were killed.They suffered burns but are in stable condition, zoo director Wolfgang Dressen said.“This is an unfathomable tragedy.”

YOU MIGHT BE INTERESTED IN...Sky lanterns, which are sometimes also called Chinese lanterns, are a sort of hot-air balloon made of paper.","Los controles se realizaron en el último día del año 2019 e incluyó las localidades de San José de las Salinas, Lucio V. Mansilla y en la Comuna El Tuscal

(Tulumba) – En el marco de tareas preventivas, efectivos de la Fuerza Policial Antinarcotráfico realizaron una serie de patrullajes y controles antinarcóticos en las localidades de San José de las Salinas, Lucio V. Mansilla y en la Comuna El Tuscal.

Durante el dispositivo, en conjunto con Policía Caminera, se controlaron vehículos y personas en diferentes sectores de las localidades ubicadas en el departamento Tulumba de la provincia de Córdoba. Además se trabajó sobre Ruta Nacional 60 y en caminos alternativos.

Cabe mencionar que el operativo se efectúa como parte de las etapas de contención y compresión territorial del Programa de Lucha Integral contra el Narcomenudeo en la provincia de Córdoba. No se registraron detenidos.","Qué mejor manera de recibir el nuevo año que con una postal de la hermosa Natti Natasha sobe un barco presumiendo sus despampanantes curvas ¡y en bikini!

Sin dudas, Natti ha tenido un excelente año a nivel laboral y personal. Se ha convertido en una de las cantantes más importantes de la actualidad y una de las figuras con mayor influencia en las redes sociales ¡Y por eso decidió empezarlo con todo!

El 2020 la encontró a la sensual cantante sobre un yate y luciendo un infernal bikini negro que enloqueció a sus más de 20.000.000 de seguidores en Instagram.

La publicación ya supera el 1.200.000 de likes y recibió miles de halagos por parte de sus seguidores en los comentarios. No contenta con una sola foto, la bella Natti compartió cinco postales en traje de baño para recibir al 2020.

En ella, la dominicana escribió: ""Mi Top 5 de fin de año! Cuál es tu top 5?"", en referencia a sus fotos. Y los folllowers no tardaron en responderle a la candente cantante.

Además de su sensual producción de fotos sobre el yate, Natti Natasha celebró la llegada de 2020 con un diminuto vestido dorado y alzando una copa para brindar por el nuevo año.

De esa manera, la cantante les deseó a todos sus seguidores un feliz año nuevo. Los cuales no tardaron en retribuirle el saludo a través de los comentarios en la red social."
en,en,1484698254_1483758694,1,2,1,2.333333333,2.333333333,1,1.333333333,"Trump Brings In 2020 At Mar-a-Lago: ‘We’re Going To Have A Great Year’(Breitbart) – President Donald Trump welcomed guests to Mar-a-Lago for a New Year’s Eve party on Tuesday evening, predicting great things for 2020.

“We’re going to have a great year, I predict,” Trump said. “I think it’s going to be a fantastic year.”

The president noted the record year for the American economy, predicting even better economic news.

“I think we’re really set for additional growth and jobs and everything else,” he said. “It’ll be great.”

The president answered questions about the ongoing conflict in Iraq after the American embassy in Baghdad was beset by protesters and American Marines responded.

“They were there instantaneously, as soon as we heard,” he said. “I used the word ‘immediately’; they came immediately. And it’s in great shape, as you know.”

He compared the recent attacks to the devastating attacks in Benghazi in 2012, noting that he would never stand for similar results.

“This will not be a Benghazi. Benghazi should never have happened,” he said. “This will never, ever be a Benghazi.”

The president warned Iran from continuing to back militia attacks in Iraq but dismissed the idea that the United States was going to war with Iran.

“I want to have peace. I like peace,” he said. “And Iran should want peace more than anybody. So I don’t see that happening.”

The president also spoke about the impeachment effort led by House Speaker Nancy Pelosi.

“I think the impeachment thing — I call it impeachment light,” he said. “It’s a disgrace. And Nancy Pelosi should be ashamed of herself. She’s a highly overrated person. I know her well; she’s highly overrated.”

Trump said he looked forward to an impeachment trial in the Senate.

“As far as I’m concerned, I’d be very happy with the trial because we did nothing wrong,” he said.

The president even wished the press a Happy New Year.

“I want you to have a great year. Look, you’re honorable people. You have to stay honorable,” he said. “If you’re honorable, I’m going to win the election by a lot. If you’re not honorable, I’m just going to win the election by a little. So I’d rather have you be honorable, okay?”

When First Lady Melania Trump was asked about her hopes for the New Year, she replied, “Peace on the world.”

President Trump agreed but said he would not reveal his New Year’s resolution.

“I’m not sure you’re supposed to say resolutions out loud, okay?” he said. “So we don’t want to. I don’t want to say what my resolution is because I think we jinx it, all right?”

Video: “THIS WILL NOT BE A BENGHAZI” President Trump says ahead of entering Mar-A-Lago NYE party

breitbart.com/politics/2019/12/31/trump-brings-2020-mar-a-lago-were-going-have-great-year/","Trump says he does not expect war with Iran, ‘likes peace’PALM BEACH, United States — US President Donald Trump on Tuesday said he does not foresee war with Tehran, after pro-Iranian demonstrators stormed the US embassy in Iraq.

“I don’t see that happening,” Trump said at his holiday retreat in Florida when a reporter asked about the possibility of war with the Islamic republic.

“I like peace,” the president said before heading in to New Year’s celebrations.

Get The Times of Israel's Daily Edition by email and never miss our top stories Free Sign Up

The president spoke after Defense Secretary Mark Esper said that around 750 troops from a rapid response unit of the 82nd Airborne Division are prepared to deploy over the next several days to the Middle East.

The US had already flown a rapid response team of Marines into Baghdad to reinforce its embassy after the attack Tuesday, which left smoke and flames rising from the compound’s entrance and further heightened tension between Tehran and Washington.

US officials said there were no plans to evacuate the mission, and no US personnel were reported injured.

The US reinforcements “got in there very quickly,” Trump said.

“I think it’s been handled very well.”

He added that “this will not be a Benghazi,” a reference to an attack in 2012 by radical Islamists on the US consulate in Benghazi, Libya. Four Americans were killed inside the smoke-clogged building including the ambassador, Chris Stevens.","“I think we’re really set for additional growth and jobs and everything else,” he said.And Nancy Pelosi should be ashamed of herself.Look, you’re honorable people.“If you’re honorable, I’m going to win the election by a lot.If you’re not honorable, I’m just going to win the election by a little.","“I don’t see that happening,” Trump said at his holiday retreat in Florida when a reporter asked about the possibility of war with the Islamic republic.The US had already flown a rapid response team of Marines into Baghdad to reinforce its embassy after the attack Tuesday, which left smoke and flames rising from the compound’s entrance and further heightened tension between Tehran and Washington.US officials said there were no plans to evacuate the mission, and no US personnel were reported injured.The US reinforcements “got in there very quickly,” Trump said.“I think it’s been handled very well.”

He added that “this will not be a Benghazi,” a reference to an attack in 2012 by radical Islamists on the US consulate in Benghazi, Libya.","We noticed you’re blocking ads!

Keep supporting great journalism by turning off your ad blocker. Or purchase a subscription for unlimited access to real news you can count on.","<s> PORT-AU-PRINCE, Haiti — Haitian President Jovenel Moïse broke with tradition on Wednesday and celebrated the country’s independence day in the capital for security reasons following months of political turmoil. Moïse, whose government has been accused of corruption, denounced graft during his speech at the National Palace in Port-au-Prince and urged Haiti’s elite to work with the government and help creat. Copyright 2020 The Associated Press. All rights reserved. This material may not be published, broadcast, rewritten or redistributed.</s"
