url1_lang,url2_lang,pair_id,Geography,Entities,Time,Narrative,Overall,Style,Tone,text1,text2,text_summary1,text_summary2,text1_truncate,text2_truncate
en,en,1484701886_1483995327,1.333333333,1.666666667,1,1.333333333,1.333333333,2,1.666666667,"North Korea's Warning to America: End Your 'Hostile Policy' Or Get NothingIn the most anticipated speech of his career today, North Korea’s Kim Jong-un told hundreds of cadre from the Workers’ Party of Korea to prepare for a long-term standoff with the United States over its drive to “seek its own political and diplomatic interests” in Korea while “wasting time away under the signboard of dialogue and negotiations.”

But to the obvious surprise of many U.S. experts, Kim hedged on making any move that would cross a red line for the Trump administration or the Pentagon. Instead, he left the door open for further negotiations over peace and denuclearization – but only if the United States “rolls back its hostile policy towards the DPRK” and helps build “a lasting and durable peace-keeping mechanism” on the peninsula.

In some ways, Kim’s remarks restated the regime’s long-standing policy on talking to Washington, with an extra dose of determination to withstand the withering U.S. and UN sanctions that have crippled Kim’s attempts to remake North Korea’s economy and stifled any moves towards inter-Korean reconciliation over the last two years. “The DPRK-U.S. stand-off which has lasted century after century has now been compressed to clear stand-off between self-reliance and sanctions,” he said.

If that situation continues, Kim declared, the “long confrontation” with the U.S. might include the introduction “in the near future” of a “new strategic weapon” that he declined to describe (apart from being capable of “shocking actual action.”) Moreover, he would show his new hand by ending the halt he declared in 2018 to further development of nuclear weapons and the “test-fire” of long-range ICBMs capable of hitting the United States. “There is no ground for us to get unilaterally bound to that commitment any longer,” he said.

To make the case for ending the moratorium, Kim pointed to the “big and small” military drills carried out by the U.S. military in and around Korea since the talks began in 2018, and its introduction of “ultra-modern warfare equipment” from the United States into South Korea. As he spoke, a fleet of U.S. spy planes, based primarily in nearby Okinawa and carrying the most sophisticated surveillance equipment in the world, combed Korean skies looking for any signs of new tests that would violate the moratorium.

Read the original article.","Here’s North Korea’s New Year’s gift to the worldWe didn’t wind up getting that Christmas present from Kim Jong-un that he promised. (Not even the vase that President Trump suggested.) While most of us were expecting either a weapon’s test or a missile launch, all remained quiet in the hermit nation for the remainder of the year. But this morning the dictator released a statement through his country’s state-run media outlets that appears to explain what the real “present” was going to be. As of today, North Korea is no longer considering itself bound to the weapons testing moratorium agreed to between Kim and Trump. (NY Times)

North Korea’s leader, Kim Jong-un, ​said his country no longer felt bound by its self-imposed moratorium on testing nuclear weapons and long-range ballistic missiles, its official media reported on Wednesday, the strongest indication yet that the country could soon resume such tests… North Korea has not conducted a long-range missile test or a nuclear test in more than two years. Mr. Kim had announced his moratorium at a time when he hoped negotiations with the United States — and his budding personal relationship with President Trump — would prompt the United States to begin lifting crippling sanctions.

Kim was still being rather vague about what he plans to do, but he promised that the world would soon see a “new strategic weapon” being deployed from the Korean Peninsula. (The Hill)

North Korean leader Kim Jong Un warned the world will witness “a new strategic weapon” from the isolated nation in the “near future” as nuclear negotiations between Washington and Pyongyang are stuck in a stalemate. According to reports of his remarks from North Korean state media, Kim blasted the U.S. for its “hostile policy” toward North Korea and said he had no expectation Washington would lift sanctions on his country soon.

Reached for comment at Mar-a-Lago, President Trump appeared to discount the threat, saying that he still believes Kim Jong-un is “a man of his word” and will find a way to close the deal. Of course, that’s pretty much been Trump’s modus operandi throughout this entire process. Keep flattering Kim while refusing to give in to his demands. And Trump will no doubt continue to play nice until it’s time get tough.

As long as North Korea is only talking about violating the agreement and not actually doing it, there’s still time to cut a deal. It’s even conceivable that Trump could put some small concession on the table along the lines of a partial withdrawal of one or two minor sanctions. That would at least give Kim something to take home and claim a victory if he’s willing to at least continue the moratorium, if not actually start dismantling his nukes.

But in reality, those nukes are the only thing keeping Kim in power, at least in his view. It’s almost impossible to conceive of him really carrying through on a comprehensive denuclearization program.

So if he doesn’t, what might the “new strategic weapon” be? Intelligence analysts seem to think it will be one of two things. Either he’ll light off a fully functional hydrogen bomb or he’ll test an ICBM with solid fuel propellant that can definitely make it all the way across the Pacific to the west coast of the United States. Either one would be provocative in the extreme and send us right back to where we were stuck before Trump reached out to him.

2020 may be starting off on an upward path domestically but in terms of our negotiations with North Korea, we’re already hitting a sour note. And with Russia and China courting Kim’s favor these days, I’m not particularly hopeful of the situation improving any time soon.","North Korea's Warning to America: End Your 'Hostile Policy' Or Get NothingIn the most anticipated speech of his career today, North Korea’s Kim Jong-un told hundreds of cadre from the Workers’ Party of Korea to prepare for a long-term standoff with the United States over its drive to “seek its own political and diplomatic interests” in Korea while “wasting time away under the signboard of dialogue and negotiations.”

But to the obvious surprise of many U.S. experts, Kim hedged on making any move that would cross a red line for the Trump administration or the Pentagon.Instead, he left the door open for further negotiations over peace and denuclearization – but only if the United States “rolls back its hostile policy towards the DPRK” and helps build “a lasting and durable peace-keeping mechanism” on the peninsula.In some ways, Kim’s remarks restated the regime’s long-standing policy on talking to Washington, with an extra dose of determination to withstand the withering U.S. and UN sanctions that have crippled Kim’s attempts to remake North Korea’s economy and stifled any moves towards inter-Korean reconciliation over the last two years.“The DPRK-U.S. stand-off which has lasted century after century has now been compressed to clear stand-off between self-reliance and sanctions,” he said.“There is no ground for us to get unilaterally bound to that commitment any longer,” he said.","Here’s North Korea’s New Year’s gift to the worldWe didn’t wind up getting that Christmas present from Kim Jong-un that he promised.As long as North Korea is only talking about violating the agreement and not actually doing it, there’s still time to cut a deal.That would at least give Kim something to take home and claim a victory if he’s willing to at least continue the moratorium, if not actually start dismantling his nukes.But in reality, those nukes are the only thing keeping Kim in power, at least in his view.So if he doesn’t, what might the “new strategic weapon” be?",,
en,en,1484010878_1484010762,4,4,1,3.5,4,2,2,"10 years after surgery, Ryan Westmoreland lands coaching job at UMass-DartmouthThis coming March, it will have been 10 years since Ryan Westmoreland experienced the scariest day of his life. He was on an operating table at St. Joseph’s Hospital and Medical Center in Phoenix as Dr. Robert Spetzler prepped for a five-hour procedure to remove a cavernous malformation on his brain stem.

At the time, Westmoreland was the No. 1 prospect in the Boston Red Sox organization and the 21st-ranked minor league player in all of baseball. But as doctors started to put the former Portsmouth High School star under anesthesia, his thoughts didn’t drift toward a future career in the bigs and he wasn’t dwelling on when he’d get back on the field.

He was praying he’d make it through alive.

Nearly a decade has passed since March 16, 2010 — the date of that surgery, which is emblazoned on his arm with a tattoo — and on the anniversary, Westmoreland will be back on the field as an assistant coach on Bob Prince’s staff at UMass Dartmouth.

“It was perfect. I had lost two of my assistant coaches to head coaching jobs, and I had been passively looking [to replace them],” Prince said. “The timing couldn’t have been any better. I reached out to Ryan and it went from there. We had a nice conversation in regards to the program and his role, his expectations.”

Westmoreland is currently working with teenage players with the Ocean State Makos, an AAU team. And, in a way, that’s how he ended up with the Corsairs. He was touting some of his players to Rian McCarthy, an assistant coach and recruiting coordinator with UMass Dartmouth. McCarthy, who had previously coached the Post 18 American Legion team in Newport, asked Westmoreland if he had considered coaching at the next level.

“I said absolutely,” Westmoreland said. “I wasn’t reaching out for jobs, but he asked me if I’d be interested, I talked with Coach Prince and it snowballed from there. I’m excited.”

When Westmoreland’s professional baseball career ended in 2013, he never envisioned himself as a coach. But after starting with the Portsmouth High School freshman team in 2015, then working with the Makos, he realized he could impart his vast knowledge of the game on the next generation of future stars.

And he found it quite enjoyable.

“When I retired, I wasn’t dead set on being a coach,” Westmoreland said. “The first year I coached, I said to myself, ‘I have a lot of knowledge and things I can teach.’ Not only the physical, but also the mental part of the game. I can teach what I’ve learned and then watch them to grow up and be successful.”

Westmoreland was a star at Portsmouth High School, twice named the state’s Gatorade Player of the Year, before graduating in 2008. That year, he was chosen by the Red Sox in the fifth round of the MLB First-Year Player draft. A five-tool player with tremendous potential, Westmoreland by the end of his second professional season was named the club’s top prospect.

But early in 2010, he felt tingling in his fingers and realized something wasn’t right. Westmoreland had a cavernous malformation on his brain stem that required a dangerous surgical procedure. He attempted a comeback and was invited to Red Sox spring training in 2011, but a second surgery forced him to give up the game he loves so much at just 22 years old.

There were some dark times, but Westmoreland found solace in coaching. Now he’ll take the next step in what he hopes is a lifelong endeavor. With UMass Dartmouth, Westmoreland said he won’t have a defined role, but is willing to do what is asked of him.

″[Coach Prince] just said, ‘We want you to be part of our program,’ And that was huge for me, because I’ve never coached in college,” Westmoreland said. “It looks like whatever I can do to help the team, and whatever Coach Prince wants me to do, I’m happy to do it.”

Prince knows what he’s getting in Westmoreland.

“He brings a lot,” Prince said. “Just the experience in terms of playing and the process and the grind that these kids go through. And he’s been working with kids who are at a high level. He’s been successful at developing players, and that’s what we’re about — developing players and people.”

Prince said Westmoreland isn’t hesitant to talk about what happened 10 years ago, and that most of the players already know his story. Infielder JR DiSarcina is the son of Gary DiSarcina, who was the manager of the Lowell Spinners when Westmoreland was with the club in 2009.

“When [the players] caught wind of what was going on, we were all on a group text, and one of the players said, ‘Oh my God, I have his rookie card and he autographed it for me.’ The kids know who he is,” Prince said.

For Westmoreland, this coaching position could be a stepping stone.

“I really hope it opens that door,” Westmoreland said. “Ever since I started coaching, I knew I wanted a future in this. I was looking to get into the college baseball world, and we’ll see where it goes from there. But this is a great opportunity.”

And he has a backer in Prince.

“He wants to be involved in baseball at a high level, whether it’s coaching in college, professionally or scouting,” Prince said. “My job, as it is with my players, is to help him get him to where he wants to go.”","Two-time Semi Finalist Vera Zvonareva to Miss Australian OpenFormer World No. 2 Vera Zvonareva will miss the Australian Open - the first Grand Slam of the 2020 season - due to problems with her left wrist. The 35 year old Russian has been a semi-finalist at the Australian Open on two occasions in her career - in 2009 and 2011.

She has also reached the finals in a Grand Slam on two occasions - at Wimbledon and the US Open in 2010. Zvonareva last played in the main draw of the Australian Open in 2015, when she reached the second round and had lost in the first round of qualifying in Melbourne in 2018 and 2019.

She is a former doubles champion at this tournament - having won the 2012 doubles title with fellow Russian Svetlana Kuznetsova. Zvonareva joins former World No. 1 Victoria Azarenka on the sidelines of the tournament on the women's side - the Belarusian has missed the tournament due to personal reasons.

The 35-year-old Russian is ranked No. 159 in the world currently but had entered the event by using her protected ranking. On the men's side, former World No. 1 Andy Murray, Japan's Kei Nishikori and Frenchman Lucas Pouille have also withdrawn due to injuries.

The first Grand Slam tournament of the season begins in Melbourne on January 20th.","I had lost two of my assistant coaches to head coaching jobs, and I had been passively looking [to replace them],” Prince said.“I said absolutely,” Westmoreland said.For Westmoreland, this coaching position could be a stepping stone.“Ever since I started coaching, I knew I wanted a future in this.“He wants to be involved in baseball at a high level, whether it’s coaching in college, professionally or scouting,” Prince said.","Two-time Semi Finalist Vera Zvonareva to Miss Australian OpenFormer World No.She has also reached the finals in a Grand Slam on two occasions - at Wimbledon and the US Open in 2010.Zvonareva last played in the main draw of the Australian Open in 2015, when she reached the second round and had lost in the first round of qualifying in Melbourne in 2018 and 2019.Zvonareva joins former World No.159 in the world currently but had entered the event by using her protected ranking.",,
